{
  "$schema": "../../../schema/mod.json",
  "id": "wxl.test-fields",
  "name": "Test fields",
  "version": "1.0.0",
  "abi": "0.1.10",
  "description": "Reads, watches and unwatches descriptor fields: the player's money and health, every unit's health.",
  "lua": "init.lua",
  "optional": [
    { "service": "wxl.object", "version": 1 },
    { "service": "wxl.script", "version": 1 }
  ]
}
