{
  "$schema": "../../schema/mod.json",
  "id": "wxl.probe",
  "name": "Probe",
  "version": "1.0.0",
  "abi": "0.1.13",
  "description": "A Lua test tool: it listens to every event the runtime raises and writes into the log what it saw, how often, and the marks you set with /mark, so that a test session can be read back from the log alone.",
  "lua": "init.lua",
  "optional": [
    { "service": "wxl.script", "version": 1 },
    { "service": "wxl.footprint", "version": 1 }
  ]
}
