{
  "$schema": "../../schema/mod.json",
  "id": "wxl.memory-report",
  "name": "Memory report",
  "version": "1.0.0",
  "abi": "0.1.11",
  "description": "A Lua mod: it counts the client's allocations from the start and writes where the memory goes into its own folder, every five minutes, on demand and at exit.",
  "lua": "init.lua",
  "requires": [
    { "service": "wxl.footprint", "version": 1 }
  ],
  "optional": [
    { "service": "wxl.script", "version": 1 }
  ]
}
